{
  "$schema": "https://json-schema.org/draft/2020-12/schema",
  "type": "object",
  "properties": {
    "observationId": {
      "type": "string",
      "minLength": 1
    },
    "sourceId": {
      "type": "string",
      "minLength": 1
    },
    "sourceItemId": {
      "type": "string",
      "minLength": 1
    },
    "sourceUrl": {
      "type": "string",
      "format": "uri"
    },
    "sourceTier": {
      "type": "string",
      "enum": [
        "T0",
        "T1",
        "T2",
        "T3",
        "T4"
      ]
    },
    "headline": {
      "type": "string",
      "minLength": 1
    },
    "language": {
      "type": "string",
      "minLength": 2
    },
    "revision": {
      "type": "integer",
      "minimum": 0,
      "maximum": 9007199254740991
    },
    "ingestionMethod": {
      "type": "string",
      "enum": [
        "LIVE_ADAPTER",
        "HISTORICAL_FIXTURE",
        "MANUAL_REFERENCE"
      ]
    },
    "sourceOccurredAt": {
      "anyOf": [
        {
          "type": "object",
          "properties": {
            "state": {
              "type": "string",
              "const": "KNOWN"
            },
            "value": {
              "type": "string",
              "format": "date-time",
              "pattern": "^(?:(?:\\d\\d[2468][048]|\\d\\d[13579][26]|\\d\\d0[48]|[02468][048]00|[13579][26]00)-02-29|\\d{4}-(?:(?:0[13578]|1[02])-(?:0[1-9]|[12]\\d|3[01])|(?:0[469]|11)-(?:0[1-9]|[12]\\d|30)|(?:02)-(?:0[1-9]|1\\d|2[0-8])))T(?:(?:[01]\\d|2[0-3]):[0-5]\\d(?::[0-5]\\d(?:\\.\\d+)?)?(?:Z|([+-](?:[01]\\d|2[0-3]):[0-5]\\d)))$"
            },
            "observedAt": {
              "type": "string",
              "format": "date-time",
              "pattern": "^(?:(?:\\d\\d[2468][048]|\\d\\d[13579][26]|\\d\\d0[48]|[02468][048]00|[13579][26]00)-02-29|\\d{4}-(?:(?:0[13578]|1[02])-(?:0[1-9]|[12]\\d|3[01])|(?:0[469]|11)-(?:0[1-9]|[12]\\d|30)|(?:02)-(?:0[1-9]|1\\d|2[0-8])))T(?:(?:[01]\\d|2[0-3]):[0-5]\\d(?::[0-5]\\d(?:\\.\\d+)?)?(?:Z|([+-](?:[01]\\d|2[0-3]):[0-5]\\d)))$"
            },
            "expiresAt": {
              "type": "string",
              "format": "date-time",
              "pattern": "^(?:(?:\\d\\d[2468][048]|\\d\\d[13579][26]|\\d\\d0[48]|[02468][048]00|[13579][26]00)-02-29|\\d{4}-(?:(?:0[13578]|1[02])-(?:0[1-9]|[12]\\d|3[01])|(?:0[469]|11)-(?:0[1-9]|[12]\\d|30)|(?:02)-(?:0[1-9]|1\\d|2[0-8])))T(?:(?:[01]\\d|2[0-3]):[0-5]\\d(?::[0-5]\\d(?:\\.\\d+)?)?(?:Z|([+-](?:[01]\\d|2[0-3]):[0-5]\\d)))$"
            },
            "evidenceIds": {
              "type": "array",
              "items": {
                "type": "string",
                "minLength": 1
              }
            }
          },
          "required": [
            "state",
            "value",
            "observedAt",
            "evidenceIds"
          ],
          "additionalProperties": false
        },
        {
          "type": "object",
          "properties": {
            "state": {
              "type": "string",
              "const": "UNKNOWN"
            },
            "reason": {
              "type": "string",
              "minLength": 1
            },
            "since": {
              "type": "string",
              "format": "date-time",
              "pattern": "^(?:(?:\\d\\d[2468][048]|\\d\\d[13579][26]|\\d\\d0[48]|[02468][048]00|[13579][26]00)-02-29|\\d{4}-(?:(?:0[13578]|1[02])-(?:0[1-9]|[12]\\d|3[01])|(?:0[469]|11)-(?:0[1-9]|[12]\\d|30)|(?:02)-(?:0[1-9]|1\\d|2[0-8])))T(?:(?:[01]\\d|2[0-3]):[0-5]\\d(?::[0-5]\\d(?:\\.\\d+)?)?(?:Z|([+-](?:[01]\\d|2[0-3]):[0-5]\\d)))$"
            },
            "lastCheckedAt": {
              "type": "string",
              "format": "date-time",
              "pattern": "^(?:(?:\\d\\d[2468][048]|\\d\\d[13579][26]|\\d\\d0[48]|[02468][048]00|[13579][26]00)-02-29|\\d{4}-(?:(?:0[13578]|1[02])-(?:0[1-9]|[12]\\d|3[01])|(?:0[469]|11)-(?:0[1-9]|[12]\\d|30)|(?:02)-(?:0[1-9]|1\\d|2[0-8])))T(?:(?:[01]\\d|2[0-3]):[0-5]\\d(?::[0-5]\\d(?:\\.\\d+)?)?(?:Z|([+-](?:[01]\\d|2[0-3]):[0-5]\\d)))$"
            },
            "retryAfter": {
              "type": "string",
              "format": "date-time",
              "pattern": "^(?:(?:\\d\\d[2468][048]|\\d\\d[13579][26]|\\d\\d0[48]|[02468][048]00|[13579][26]00)-02-29|\\d{4}-(?:(?:0[13578]|1[02])-(?:0[1-9]|[12]\\d|3[01])|(?:0[469]|11)-(?:0[1-9]|[12]\\d|30)|(?:02)-(?:0[1-9]|1\\d|2[0-8])))T(?:(?:[01]\\d|2[0-3]):[0-5]\\d(?::[0-5]\\d(?:\\.\\d+)?)?(?:Z|([+-](?:[01]\\d|2[0-3]):[0-5]\\d)))$"
            }
          },
          "required": [
            "state",
            "reason",
            "since"
          ],
          "additionalProperties": false
        },
        {
          "type": "object",
          "properties": {
            "state": {
              "type": "string",
              "const": "UNSUPPORTED"
            },
            "reason": {
              "type": "string",
              "minLength": 1
            }
          },
          "required": [
            "state",
            "reason"
          ],
          "additionalProperties": false
        },
        {
          "type": "object",
          "properties": {
            "state": {
              "type": "string",
              "const": "ERROR"
            },
            "reason": {
              "type": "string",
              "minLength": 1
            },
            "observedAt": {
              "type": "string",
              "format": "date-time",
              "pattern": "^(?:(?:\\d\\d[2468][048]|\\d\\d[13579][26]|\\d\\d0[48]|[02468][048]00|[13579][26]00)-02-29|\\d{4}-(?:(?:0[13578]|1[02])-(?:0[1-9]|[12]\\d|3[01])|(?:0[469]|11)-(?:0[1-9]|[12]\\d|30)|(?:02)-(?:0[1-9]|1\\d|2[0-8])))T(?:(?:[01]\\d|2[0-3]):[0-5]\\d(?::[0-5]\\d(?:\\.\\d+)?)?(?:Z|([+-](?:[01]\\d|2[0-3]):[0-5]\\d)))$"
            },
            "retryable": {
              "type": "boolean"
            }
          },
          "required": [
            "state",
            "reason",
            "observedAt",
            "retryable"
          ],
          "additionalProperties": false
        }
      ]
    },
    "sourceOccurredAtPrecision": {
      "type": "string",
      "enum": [
        "MILLISECOND",
        "SECOND",
        "MINUTE",
        "UNKNOWN"
      ]
    },
    "receivedAt": {
      "type": "string",
      "format": "date-time",
      "pattern": "^(?:(?:\\d\\d[2468][048]|\\d\\d[13579][26]|\\d\\d0[48]|[02468][048]00|[13579][26]00)-02-29|\\d{4}-(?:(?:0[13578]|1[02])-(?:0[1-9]|[12]\\d|3[01])|(?:0[469]|11)-(?:0[1-9]|[12]\\d|30)|(?:02)-(?:0[1-9]|1\\d|2[0-8])))T(?:(?:[01]\\d|2[0-3]):[0-5]\\d(?::[0-5]\\d(?:\\.\\d+)?)?(?:Z|([+-](?:[01]\\d|2[0-3]):[0-5]\\d)))$"
    },
    "accessedAt": {
      "type": "string",
      "format": "date-time",
      "pattern": "^(?:(?:\\d\\d[2468][048]|\\d\\d[13579][26]|\\d\\d0[48]|[02468][048]00|[13579][26]00)-02-29|\\d{4}-(?:(?:0[13578]|1[02])-(?:0[1-9]|[12]\\d|3[01])|(?:0[469]|11)-(?:0[1-9]|[12]\\d|30)|(?:02)-(?:0[1-9]|1\\d|2[0-8])))T(?:(?:[01]\\d|2[0-3]):[0-5]\\d(?::[0-5]\\d(?:\\.\\d+)?)?(?:Z|([+-](?:[01]\\d|2[0-3]):[0-5]\\d)))$"
    },
    "rawTextHash": {
      "type": "string",
      "pattern": "^(?:sha256|keccak256):[0-9a-f]{64}$"
    },
    "claimFingerprint": {
      "anyOf": [
        {
          "type": "object",
          "properties": {
            "state": {
              "type": "string",
              "const": "KNOWN"
            },
            "value": {
              "type": "string",
              "minLength": 1
            },
            "observedAt": {
              "type": "string",
              "format": "date-time",
              "pattern": "^(?:(?:\\d\\d[2468][048]|\\d\\d[13579][26]|\\d\\d0[48]|[02468][048]00|[13579][26]00)-02-29|\\d{4}-(?:(?:0[13578]|1[02])-(?:0[1-9]|[12]\\d|3[01])|(?:0[469]|11)-(?:0[1-9]|[12]\\d|30)|(?:02)-(?:0[1-9]|1\\d|2[0-8])))T(?:(?:[01]\\d|2[0-3]):[0-5]\\d(?::[0-5]\\d(?:\\.\\d+)?)?(?:Z|([+-](?:[01]\\d|2[0-3]):[0-5]\\d)))$"
            },
            "expiresAt": {
              "type": "string",
              "format": "date-time",
              "pattern": "^(?:(?:\\d\\d[2468][048]|\\d\\d[13579][26]|\\d\\d0[48]|[02468][048]00|[13579][26]00)-02-29|\\d{4}-(?:(?:0[13578]|1[02])-(?:0[1-9]|[12]\\d|3[01])|(?:0[469]|11)-(?:0[1-9]|[12]\\d|30)|(?:02)-(?:0[1-9]|1\\d|2[0-8])))T(?:(?:[01]\\d|2[0-3]):[0-5]\\d(?::[0-5]\\d(?:\\.\\d+)?)?(?:Z|([+-](?:[01]\\d|2[0-3]):[0-5]\\d)))$"
            },
            "evidenceIds": {
              "type": "array",
              "items": {
                "type": "string",
                "minLength": 1
              }
            }
          },
          "required": [
            "state",
            "value",
            "observedAt",
            "evidenceIds"
          ],
          "additionalProperties": false
        },
        {
          "type": "object",
          "properties": {
            "state": {
              "type": "string",
              "const": "UNKNOWN"
            },
            "reason": {
              "type": "string",
              "minLength": 1
            },
            "since": {
              "type": "string",
              "format": "date-time",
              "pattern": "^(?:(?:\\d\\d[2468][048]|\\d\\d[13579][26]|\\d\\d0[48]|[02468][048]00|[13579][26]00)-02-29|\\d{4}-(?:(?:0[13578]|1[02])-(?:0[1-9]|[12]\\d|3[01])|(?:0[469]|11)-(?:0[1-9]|[12]\\d|30)|(?:02)-(?:0[1-9]|1\\d|2[0-8])))T(?:(?:[01]\\d|2[0-3]):[0-5]\\d(?::[0-5]\\d(?:\\.\\d+)?)?(?:Z|([+-](?:[01]\\d|2[0-3]):[0-5]\\d)))$"
            },
            "lastCheckedAt": {
              "type": "string",
              "format": "date-time",
              "pattern": "^(?:(?:\\d\\d[2468][048]|\\d\\d[13579][26]|\\d\\d0[48]|[02468][048]00|[13579][26]00)-02-29|\\d{4}-(?:(?:0[13578]|1[02])-(?:0[1-9]|[12]\\d|3[01])|(?:0[469]|11)-(?:0[1-9]|[12]\\d|30)|(?:02)-(?:0[1-9]|1\\d|2[0-8])))T(?:(?:[01]\\d|2[0-3]):[0-5]\\d(?::[0-5]\\d(?:\\.\\d+)?)?(?:Z|([+-](?:[01]\\d|2[0-3]):[0-5]\\d)))$"
            },
            "retryAfter": {
              "type": "string",
              "format": "date-time",
              "pattern": "^(?:(?:\\d\\d[2468][048]|\\d\\d[13579][26]|\\d\\d0[48]|[02468][048]00|[13579][26]00)-02-29|\\d{4}-(?:(?:0[13578]|1[02])-(?:0[1-9]|[12]\\d|3[01])|(?:0[469]|11)-(?:0[1-9]|[12]\\d|30)|(?:02)-(?:0[1-9]|1\\d|2[0-8])))T(?:(?:[01]\\d|2[0-3]):[0-5]\\d(?::[0-5]\\d(?:\\.\\d+)?)?(?:Z|([+-](?:[01]\\d|2[0-3]):[0-5]\\d)))$"
            }
          },
          "required": [
            "state",
            "reason",
            "since"
          ],
          "additionalProperties": false
        },
        {
          "type": "object",
          "properties": {
            "state": {
              "type": "string",
              "const": "UNSUPPORTED"
            },
            "reason": {
              "type": "string",
              "minLength": 1
            }
          },
          "required": [
            "state",
            "reason"
          ],
          "additionalProperties": false
        },
        {
          "type": "object",
          "properties": {
            "state": {
              "type": "string",
              "const": "ERROR"
            },
            "reason": {
              "type": "string",
              "minLength": 1
            },
            "observedAt": {
              "type": "string",
              "format": "date-time",
              "pattern": "^(?:(?:\\d\\d[2468][048]|\\d\\d[13579][26]|\\d\\d0[48]|[02468][048]00|[13579][26]00)-02-29|\\d{4}-(?:(?:0[13578]|1[02])-(?:0[1-9]|[12]\\d|3[01])|(?:0[469]|11)-(?:0[1-9]|[12]\\d|30)|(?:02)-(?:0[1-9]|1\\d|2[0-8])))T(?:(?:[01]\\d|2[0-3]):[0-5]\\d(?::[0-5]\\d(?:\\.\\d+)?)?(?:Z|([+-](?:[01]\\d|2[0-3]):[0-5]\\d)))$"
            },
            "retryable": {
              "type": "boolean"
            }
          },
          "required": [
            "state",
            "reason",
            "observedAt",
            "retryable"
          ],
          "additionalProperties": false
        }
      ]
    },
    "credibilityState": {
      "type": "string",
      "enum": [
        "VERIFIED",
        "CORROBORATED",
        "UNVERIFIED",
        "DISPUTED",
        "UNKNOWN"
      ]
    },
    "entities": {
      "type": "array",
      "items": {
        "type": "string",
        "minLength": 1
      }
    },
    "schemaVersion": {
      "type": "string",
      "minLength": 1
    }
  },
  "required": [
    "observationId",
    "sourceId",
    "sourceItemId",
    "sourceUrl",
    "sourceTier",
    "headline",
    "language",
    "revision",
    "ingestionMethod",
    "sourceOccurredAt",
    "sourceOccurredAtPrecision",
    "receivedAt",
    "accessedAt",
    "rawTextHash",
    "claimFingerprint",
    "credibilityState",
    "entities",
    "schemaVersion"
  ],
  "additionalProperties": false,
  "$id": "https://virtual-risk.local/schema/legacy-v0.2-news-observation.v1.json"
}
